{
  "$schema": "https://json-schema.org/draft/2020-12/schema",
  "type": "object",
  "required": ["name", "description", "version", "author"],
  "properties": {
    "name": {"type": "string", "minLength": 1},
    "description": {"type": "string", "minLength": 1},
    "version": {"type": "string", "minLength": 1},
    "author": {"type": "object"},
    "license": {"type": "string"},
    "keywords": {"type": "array", "items": {"type": "string"}}
  },
  "additionalProperties": true
}
