{
  "name": "bloodhound-development",
  "version": "0.2.0",
  "description": "Operate isolated BHE environments, deliver BHE/BHCE changes, and run focused enterprise review and validation workflows.",
  "author": {
    "name": "SpecterOps"
  },
  "license": "UNLICENSED",
  "keywords": [
    "specterops",
    "bloodhound",
    "enterprise",
    "development",
    "playwright",
    "docker",
    "worktrees"
  ]
}
