{
  "name": "mythic-implant",
  "description": "Mythic C2 framework implant development skill with agent message protocols, payload type definitions, and step-by-step build workflow",
  "version": "0.1.0",
  "author": {
    "name": "xpn"
  },
  "license": "MIT",
  "keywords": [
    "mythic",
    "c2",
    "implant",
    "agent",
    "red-team",
    "payload"
  ]
}
