{
  "name": "reverse-engineering",
  "description": "Reverse engineering workflows and MCP-assisted binary analysis for Binary Ninja, Ghidra, and related tooling.",
  "version": "0.1.0",
  "author": {
    "name": "xpn"
  },
  "license": "MIT",
  "keywords": [
    "binary-ninja",
    "reverse-engineering",
    "bnil",
    "decompiler",
    "mcp",
    "ghidra"
  ]
}
