{
  "name": "binary-ninja-mcp",
  "description": "Binary Ninja analysis skill with BNIL IL documentation and MCP server usage guide",
  "version": "0.1.0",
  "author": {
    "name": "xpn"
  },
  "license": "MIT",
  "keywords": [
    "binary-ninja",
    "reverse-engineering",
    "bnil",
    "decompiler",
    "mcp"
  ]
}
