{
  "name": "c2-outflankc2",
  "description": "Outflank C2 (OC2) operations, BOF scripts, and event-driven bot development workflows.",
  "version": "0.2.0",
  "author": {
    "name": "Outflank"
  },
  "license": "UNLICENSED",
  "keywords": [
    "c2",
    "outflank-c2",
    "oc2",
    "bof",
    "bot",
    "python"
  ]
}
